{
  "schema_version": "1.0.0",
  "receipt_type": "governed-validator-execution-evidence",
  "manifest_id": "fixture-partial",
  "subject_id": "fixture",
  "capture_started_at": "2026-07-31T21:59:00Z",
  "capture_completed_at": "2026-07-31T21:59:01Z",
  "execution_environment": {"run_id": "102", "run_attempt": "1", "head_commit": "cccccccccccccccccccccccccccccccccccccccc"},
  "validators": [{"name": "completed", "command": ["python", "-c", "print('ok')"], "required": true, "started_at": "2026-07-31T21:59:00Z", "completed_at": "2026-07-31T21:59:01Z", "exit_code": 0, "conclusion": "success", "stdout": "ok\n", "stderr": "", "log_path": "completed.log", "log_sha256": "cccccccccccccccccccccccccccccccccccccccccccccccccccccccccccccccc", "log_byte_size": 3}],
  "first_failed_validator": null,
  "overall_conclusion": "partial",
  "activation_effect": "indeterminate",
  "authority": {"may_promote_publication": false, "may_assert_primary_source_completion": false, "may_change_chain_node_confidence": false},
  "notes": "Partial fixture represents an incomplete planned validator set and cannot activate anything."
}
